{
  "schemaVersion": "1.0",
  "name": "files",
  "description": "An outstation that serves files by DNP3 file transfer (group 70): a short text file, a file of several blocks in a directory, and an empty directory. For adapters with the feature fileServer.",
  "outstation": {
    "address": 1024,
    "masterAddress": 1,
    "needTime": true
  },
  "binaryInputs": [
    {
      "index": 0,
      "value": true
    }
  ],
  "files": [
    {
      "name": "/readme.txt",
      "content": "48656c6c6f2066726f6d2074686520646e70332d696e7465726f702066696c657320666978747572652e0a"
    },
    {
      "name": "/data/blocks.bin",
      "content": "030a11181f262d343b424950575e656c737a81888f969da4abb2b9c0c7ced5dce3eaf1f8ff060d141b222930373e454c535a61686f767d848b9299a0a7aeb5bcc3cad1d8dfe6edf4fb020910171e252c333a41484f565d646b727980878e959ca3aab1b8bfc6cdd4dbe2e9f0f7fe050c131a21282f363d444b525960676e757c838a91989fa6adb4bbc2c9d0d7dee5ecf3fa01080f161d242b323940474e555c636a71787f868d949ba2a9b0b7bec5ccd3dae1e8eff6fd040b121920272e353c434a51585f666d747b828990979ea5acb3bac1c8cfd6dde4ebf2f900070e151c232a31383f464d545b626970777e858c939aa1a8afb6bdc4cbd2d9e0e7eef5fc030a11181f262d343b424950575e656c737a81888f969da4abb2b9c0c7ced5dce3eaf1f8ff060d141b222930373e454c535a61686f767d848b9299a0a7aeb5bcc3cad1d8dfe6edf4fb020910171e252c333a41484f565d646b727980878e959ca3aab1b8bfc6cdd4dbe2e9f0f7fe050c131a21282f363d444b525960676e757c838a91989fa6adb4bbc2c9d0d7dee5ecf3fa01080f161d242b323940474e555c636a71787f868d949ba2a9b0b7bec5ccd3dae1e8eff6fd040b121920272e353c434a51585f666d747b828990979ea5acb3bac1c8cfd6dde4ebf2f900070e151c232a31383f464d545b626970777e858c939aa1a8afb6bdc4cbd2d9e0e7eef5fc030a11181f262d343b424950575e656c737a81888f969da4abb2b9c0c7ced5dce3eaf1f8ff060d141b222930373e454c535a61686f767d848b9299a0a7aeb5bcc3cad1d8dfe6edf4fb020910171e252c333a41484f565d646b727980878e959ca3aab1b8bfc6cdd4dbe2e9f0f7fe050c131a21282f363d444b525960676e757c838a91989fa6adb4bbc2c9d0d7dee5ecf3fa01080f161d242b323940474e555c636a71787f868d949ba2a9b0b7bec5ccd3dae1e8eff6fd040b121920272e353c434a51585f666d747b828990979ea5acb3bac1c8cfd6dde4ebf2f900070e151c232a31383f464d545b626970777e858c939aa1a8afb6bdc4cbd2d9e0e7eef5fc030a11181f262d343b424950575e656c737a81888f969da4abb2b9c0c7ced5dce3eaf1f8ff060d141b222930373e454c535a61686f767d848b9299a0a7aeb5bcc3cad1d8dfe6edf4fb020910171e252c333a41484f565d646b727980878e959ca3aab1b8bfc6cdd4dbe2e9f0f7fe050c131a21282f363d444b525960676e757c838a91989fa6adb4bbc2c9d0d7dee5ecf3fa01080f161d242b323940474e555c636a71787f868d949ba2a9b0b7bec5ccd3dae1e8eff6fd040b121920272e353c434a51585f666d747b828990979ea5acb3bac1c8cfd6dde4ebf2f900070e151c232a31383f464d545b626970777e858c939aa1a8afb6bdc4cbd2d9e0e7eef5fc030a11181f262d343b424950575e656c737a81888f969da4abb2b9c0c7ced5dce3eaf1f8ff060d141b222930373e454c535a61686f767d848b9299a0a7aeb5bcc3cad1d8dfe6edf4fb020910171e252c333a41484f565d646b727980878e959ca3aab1b8bfc6cdd4dbe2e9f0f7fe050c131a21282f363d444b525960676e757c838a91989fa6adb4bbc2c9d0d7dee5ecf3fa01080f161d242b323940474e555c636a71787f868d949ba2a9b0b7bec5ccd3dae1e8eff6fd040b121920272e353c434a51585f666d747b828990979ea5acb3bac1c8cfd6dde4ebf2f900070e151c232a31383f464d545b626970777e858c939aa1a8afb6bdc4cbd2d9e0e7eef5fc030a11181f262d343b424950575e656c737a81888f969da4abb2b9c0c7ced5dce3eaf1f8ff060d141b222930373e454c535a61686f767d848b9299a0a7aeb5bcc3cad1d8dfe6edf4fb020910171e252c333a41484f565d646b727980878e959ca3aab1b8bfc6cdd4dbe2e9f0f7fe050c131a21282f363d444b525960676e757c838a91989fa6adb4bbc2c9d0d7dee5ecf3fa01080f161d242b323940474e555c636a71787f868d949ba2a9b0b7bec5ccd3dae1e8eff6fd040b121920272e353c434a51585f666d747b828990979ea5acb3bac1c8cfd6dde4ebf2f900070e151c232a31383f464d545b626970777e858c939aa1a8afb6bdc4cbd2d9e0e7eef5fc030a11181f262d343b424950575e656c737a81888f969da4abb2b9c0c7ced5dce3eaf1f8ff060d141b222930373e454c535a61686f767d848b9299a0a7aeb5bcc3cad1d8dfe6edf4fb020910171e252c333a41484f565d646b727980878e959ca3aab1b8bfc6cdd4dbe2e9f0f7fe050c131a21282f363d444b525960676e757c838a91989fa6adb4bbc2c9d0d7dee5ecf3fa01080f161d242b323940474e555c636a71787f868d949ba2a9b0b7bec5ccd3dae1e8eff6fd040b121920272e353c434a51585f666d747b828990979ea5acb3bac1c8cfd6dde4ebf2f900070e151c232a31383f464d545b626970777e858c939aa1a8afb6bdc4cbd2d9e0e7eef5fc030a11181f262d343b424950575e656c737a81888f969da4abb2b9c0c7ced5dce3eaf1f8ff060d141b222930373e454c535a61686f767d848b9299a0a7aeb5bcc3cad1d8dfe6edf4fb020910171e252c333a41484f565d646b727980878e959ca3aab1b8bfc6cdd4dbe2e9f0f7fe050c131a21282f363d444b525960676e757c838a91989fa6adb4bbc2c9d0d7dee5ecf3fa01080f161d242b323940474e555c636a71787f868d949ba2a9b0b7bec5ccd3dae1e8eff6fd040b121920272e353c434a51585f666d747b828990979ea5acb3bac1c8cfd6dde4ebf2f900070e151c232a31383f464d545b626970777e858c939aa1a8afb6bdc4cbd2d9e0e7eef5fc030a11181f262d343b424950575e656c737a81888f969da4abb2b9c0c7ced5dce3eaf1f8ff060d141b222930373e454c535a61686f767d848b9299a0a7aeb5bcc3cad1d8dfe6edf4fb020910171e252c333a41484f565d646b727980878e959ca3aab1b8bfc6cdd4dbe2e9f0f7fe050c131a21282f363d444b525960676e757c838a91989fa6adb4bbc2c9d0d7dee5ecf3fa01080f161d242b323940474e555c636a71787f868d949ba2a9b0b7bec5ccd3dae1e8eff6fd040b121920272e353c434a51585f666d747b828990979ea5acb3bac1c8cfd6dde4ebf2f900070e151c232a31383f464d545b626970777e858c939aa1a8afb6bdc4cbd2d9e0e7eef5fc030a11181f262d343b424950575e656c737a81888f969da4abb2b9c0c7ced5dce3eaf1f8ff060d141b222930373e454c535a61686f767d848b9299a0a7aeb5bcc3cad1d8dfe6edf4fb020910171e252c333a41484f565d646b727980878e959ca3aab1b8bfc6cdd4dbe2e9f0f7fe050c131a21282f363d444b525960676e757c838a91989fa6adb4bbc2c9d0d7dee5ecf3fa01080f161d242b323940474e555c636a71787f868d949ba2a9b0b7bec5ccd3dae1e8eff6fd040b121920272e353c434a51585f666d747b828990979ea5acb3bac1c8cfd6dde4ebf2f900070e151c232a31383f464d545b626970777e858c939aa1a8afb6bdc4cbd2d9e0e7eef5fc030a11181f262d343b424950575e656c737a81888f969da4abb2b9c0c7ced5dce3eaf1f8ff060d141b222930373e454c535a61686f767d848b9299a0a7aeb5bcc3cad1d8dfe6edf4fb020910171e252c333a41484f565d646b727980878e959ca3aab1b8bfc6cdd4dbe2e9f0f7fe050c131a21282f363d444b525960676e757c838a91989fa6adb4bbc2c9d0d7dee5ecf3fa01080f161d242b323940474e555c636a71787f868d949ba2a9b0b7bec5ccd3dae1e8eff6fd040b121920272e353c434a51585f666d747b828990979ea5acb3bac1c8cfd6dde4ebf2f900070e151c232a31383f464d545b626970777e858c939aa1a8afb6bdc4cbd2d9e0e7eef5fc030a11181f262d343b424950575e656c737a81888f969da4abb2b9c0c7ced5dce3eaf1f8ff060d141b222930373e454c535a61686f767d848b9299a0a7aeb5bcc3cad1d8dfe6edf4fb020910171e252c333a41484f565d646b727980878e959ca3aab1b8bfc6cdd4dbe2e9f0f7fe050c131a21282f363d444b525960676e757c838a91989fa6adb4bbc2c9d0d7dee5ecf3fa01080f161d242b323940474e555c636a71787f868d949ba2a9b0b7bec5ccd3dae1e8eff6fd04"
    }
  ],
  "directories": [
    "/logs"
  ]
}
